{
  "$schema": "https://json-schema.org/draft/2020-12/schema",
  "type": "object",
  "properties": {
    "blocked": {
      "type": [
        "string",
        "null"
      ]
    },
    "deletes": {
      "type": "array",
      "items": {
        "type": "object",
        "properties": {
          "entity": {
            "type": "string"
          },
          "count": {
            "type": "integer"
          },
          "names": {
            "type": "array",
            "items": {
              "type": "string"
            }
          }
        },
        "additionalProperties": false
      }
    },
    "unlinks": {
      "type": "array",
      "items": {
        "$ref": "#/properties/deletes/items"
      }
    },
    "warnings": {
      "type": "array",
      "items": {
        "type": "string"
      }
    }
  },
  "additionalProperties": false
}