{"blocked":null,"deletes":[{"entity":"event_message","count":2,"names":["Santa is airborne over the valley.","Watch the roof to the west."]},{"entity":"event_status_history","count":3,"names":[]},{"entity":"cookie","count":41,"names":[]},{"entity":"location","count":1832,"names":[]}],"unlinks":[],"warnings":[]}